{
  "schema_version": 1,
  "as_of": "2026-08-12",
  "source_revisions": {
    "dotmac_starter_mt": "c8237bd",
    "dotmac_sub": "9f6f9f36b",
    "dotmac_crm": "c64b5aa0",
    "dotmac_erp": "766d4c0e",
    "dotmac_vendor_control_plane": "eb667fa"
  },
  "assemblies": [
    {
      "id": "asm.starter",
      "name": "Dotmac Starter (reference assembly)",
      "sku": false,
      "repository": "dotmac_starter_mt"
    },
    {
      "id": "asm.isp",
      "name": "Dotmac ISP",
      "sku": true,
      "repository": "dotmac_sub",
      "note": "Subscriber/network modules plus selected shared modules."
    },
    {
      "id": "asm.backoffice",
      "name": "Dotmac Backoffice",
      "sku": true,
      "repository": "dotmac_erp",
      "note": "Selected business modules. ERP has adopted no kernel — see dec.adoption.erp-kernel-prerequisite."
    },
    {
      "id": "asm.engagement",
      "name": "Dotmac Engagement",
      "sku": true,
      "repository": "dotmac_crm",
      "note": "CRM capabilities. Duplicate operational state is retired, not extracted."
    },
    {
      "id": "asm.academy",
      "name": "Dotmac Academy",
      "sku": true,
      "repository": "dotmac_academy_app"
    },
    {
      "id": "asm.vendor-cp",
      "name": "Dotmac Vendor Control Plane",
      "sku": false,
      "repository": "dotmac_vendor_control_plane"
    }
  ],
  "modules": [
    {
      "id": "mod.kernel",
      "display_code": "M00",
      "name": "dotmac-kernel",
      "kind": "host-facility",
      "band": "foundation",
      "distribution": "dotmac-kernel",
      "namespace": null,
      "owns_capabilities": [
        "cap.platform.tenancy",
        "cap.platform.party-registry",
        "cap.platform.idempotent-execution",
        "cap.platform.transactional-outbox",
        "cap.comms.consent",
        "cap.comms.delivery-dispatch",
        "cap.comms.channel-policy",
        "cap.licensing.envelope-verification"
      ],
      "source_repositories": [
        "dotmac_starter_mt"
      ],
      "evidence": [
        "dotmac_starter_mt:docs/ARCHITECTURE.md"
      ],
      "note": "The host. Owns `public`; not a stateful module and has no mod_* lineage."
    },
    {
      "id": "mod.ui",
      "display_code": "M0U",
      "name": "dotmac-ui",
      "kind": "host-facility",
      "band": "foundation",
      "distribution": "dotmac-ui",
      "namespace": null,
      "owns_capabilities": [
        "cap.presentation.design-tokens"
      ],
      "source_repositories": [
        "dotmac_sub",
        "dotmac_erp"
      ],
      "evidence": [
        "dotmac_starter_mt:docs/inventories/ui-surface-inventory.md"
      ]
    },
    {
      "id": "mod.template-studio",
      "display_code": "M01",
      "name": "dotmac-template-studio",
      "kind": "module",
      "band": "shared-capability",
      "distribution": "dotmac-template-studio",
      "namespace": {
        "db_schema": "mod_tstudio",
        "migration_prefix": "ts",
        "branch_label": "template_studio",
        "allocated": true
      },
      "owns_capabilities": [
        "cap.content.template-authoring"
      ],
      "source_repositories": [
        "dotmac_erp",
        "dotmac_sub"
      ],
      "evidence": [
        "dotmac_starter_mt:docs/inventories/template-studio-source-audit.md"
      ]
    },
    {
      "id": "mod.ticketing",
      "display_code": "M02",
      "name": "dotmac-ticketing",
      "kind": "module",
      "band": "shared-capability",
      "distribution": "dotmac-ticketing",
      "namespace": {
        "db_schema": "mod_tkt",
        "migration_prefix": "tk",
        "branch_label": "ticketing",
        "allocated": true
      },
      "owns_capabilities": [
        "cap.support.ticket-lifecycle"
      ],
      "source_repositories": [
        "dotmac_sub",
        "dotmac_crm",
        "dotmac_erp"
      ],
      "evidence": [
        "dotmac_starter_mt:docs/inventories/ticket-sources.md"
      ]
    },
    {
      "id": "mod.conversations",
      "display_code": "M03",
      "name": "dotmac-conversations",
      "kind": "module",
      "band": "shared-capability",
      "distribution": null,
      "namespace": {
        "db_schema": "mod_ibx",
        "migration_prefix": "ib",
        "branch_label": "inbox",
        "allocated": true
      },
      "owns_capabilities": [
        "cap.inbound.conversation-thread"
      ],
      "source_repositories": [
        "dotmac_sub",
        "dotmac_crm"
      ],
      "evidence": [
        "dotmac_starter_mt:docs/inventories/inbox-sources.md"
      ],
      "note": "Prototype on branch docs/omni-inbox-sources. Distribution deliberately null: not published, no kernel owner declared."
    },
    {
      "id": "mod.licensing",
      "display_code": "M51",
      "name": "licensing",
      "kind": "host-facility",
      "band": "foundation",
      "distribution": null,
      "namespace": null,
      "owns_capabilities": [
        "cap.licensing.grant-projection"
      ],
      "source_repositories": [
        "dotmac_starter_mt",
        "dotmac_vendor_control_plane"
      ],
      "evidence": [
        "dotmac_starter_mt:docs/adr/0007-deployment-authenticated-applied-state.md"
      ],
      "note": "Classified host-facility, not a stateful module: its tables live in the host assembly's own lineage (a002/a003), so it cannot also claim a mod_* namespace. Resolves the draft's M51 contradiction."
    }
  ],
  "capabilities": [
    {
      "id": "cap.platform.tenancy",
      "name": "Tenant identity, domains and request-scoped isolation",
      "target_boundary": "kernel-primitive",
      "owned_facts": [
        {
          "key": "fact.platform.tenant-exists",
          "statement": "A tenant and its domains exist and resolve.",
          "transitions": [
            "provisioned->active",
            "active->suspended"
          ]
        }
      ],
      "current_claims": [
        {
          "repository": "dotmac_starter_mt",
          "owner": "dotmac_kernel.models"
        }
      ],
      "adjudication": null
    },
    {
      "id": "cap.platform.party-registry",
      "name": "Fleet-wide principal identity (Party)",
      "target_boundary": "kernel-primitive",
      "owned_facts": [
        {
          "key": "fact.identity.party-exists",
          "statement": "A person or organization exists as one fleet-wide principal."
        }
      ],
      "current_claims": [
        {
          "repository": "dotmac_starter_mt",
          "owner": "dotmac_kernel.models.Party"
        },
        {
          "repository": "dotmac_sub",
          "owner": "party.registry",
          "evidence": [
            "dotmac_sub:app/services/sot_registry/domains/party_identity.py"
          ]
        },
        {
          "repository": "dotmac_erp",
          "owner": "app/models/person.py + app/models/people/",
          "evidence": [
            "dotmac_erp:app/models/people"
          ]
        },
        {
          "repository": "dotmac_crm",
          "owner": "app/models/person.py",
          "evidence": [
            "dotmac_crm:app/models/person.py"
          ]
        }
      ],
      "adjudication": "dec.identity.principal-mapping"
    },
    {
      "id": "cap.platform.idempotent-execution",
      "name": "At-most-once execution with result replay",
      "target_boundary": "kernel-primitive",
      "owned_facts": [
        {
          "key": "fact.platform.operation-executed-once",
          "statement": "An operation ran at most once per (tenant, scope, key), with its result replayable.",
          "transitions": [
            "absent->executed",
            "executed->replayed",
            "executed->conflict"
          ]
        }
      ],
      "current_claims": [
        {
          "repository": "dotmac_starter_mt",
          "owner": "dotmac_kernel.idempotency",
          "evidence": [
            "dotmac_starter_mt:docs/adr/0014-at-most-once-execution-has-one-owner.md"
          ]
        }
      ],
      "adjudication": null,
      "note": "ADR-0014, hard rule 21. Settled: no other module may re-decide this."
    },
    {
      "id": "cap.platform.transactional-outbox",
      "name": "Durable queue, relay, lease and retry",
      "target_boundary": "kernel-primitive",
      "owned_facts": [
        {
          "key": "fact.platform.event-enqueued",
          "statement": "A domain event was enqueued atomically with its state change and will be delivered.",
          "transitions": [
            "pending->claimed",
            "claimed->sent",
            "claimed->dead-letter"
          ]
        }
      ],
      "current_claims": [
        {
          "repository": "dotmac_starter_mt",
          "owner": "dotmac_kernel.messaging"
        },
        {
          "repository": "dotmac_sub",
          "owner": "Notification queue + tasks/notifications.py",
          "evidence": [
            "dotmac_starter_mt:docs/inventories/delivery-outbox-sources.md"
          ]
        }
      ],
      "adjudication": "dec.comms.sub-notification-queue-retirement"
    },
    {
      "id": "cap.comms.consent",
      "name": "May we contact this address on this channel",
      "target_boundary": "kernel-primitive",
      "owned_facts": [
        {
          "key": "fact.comms.address-suppressed",
          "statement": "An address is suppressed for marketing or for all traffic, and why.",
          "transitions": [
            "contactable->suppressed",
            "suppressed->contactable"
          ]
        }
      ],
      "current_claims": [
        {
          "repository": "dotmac_starter_mt",
          "owner": "dotmac_kernel.consent"
        }
      ],
      "adjudication": null
    },
    {
      "id": "cap.comms.delivery-dispatch",
      "name": "Send path and delivery receipts",
      "target_boundary": "kernel-primitive",
      "owned_facts": [
        {
          "key": "fact.comms.dispatch-outcome",